<?xml version="1.0" encoding="UTF-8"?><!--Sample XML file generated by XMLSPY v2004 rel. 3 U (http://www.xmlspy.com)--><CDR xmlns:xsi="http://www.w3.org/2001/XMLSchema-instance" xsi:noNamespaceSchemaLocation="..\..\schemas\ContextDetailResponse.xsd">	<ON>devcas1</ON>	<CN>CAS</CN>	<CD>		<NM>MAC/3453/CM/5446</NM>		<FN>MAC/192.168.100.100:8003/CM/com.cboe|@535345</FN>		<QI ne="23" nd="2" nf="2" no="5" ps="56" cs="12" st="0">			<UD>				<D>session=W_MAIN</D>				<D>class=13456</D>			</UD>		</QI>		<QI ne="23" nd="2" nf="2" no="5" ps="56" cs="12" st="0">			<UD>				<D>session=W_MAIN</D>				<D>class=23456</D>			</UD>		</QI>		<TI ce="3" sr="34" pe="4" sh="78" ptc="3" pth="34">			<UD>				<D>key1=TI Data1</D>				<D>key2=TI Data2</D>			</UD>		</TI>		<TI ce="3" sr="34" pe="4" sh="78" ptc="3" pth="34">			<UD>				<D>key1=TI Data3</D>				<D>key2=TI Data4</D>			</UD>		</TI>		<MI ca="23456" mt="343.234" sm="5636346345" xm="4534.234" ex="2" >			<UD>				<D>key1=MI Data1</D>				<D>key2=MI Data2</D>			</UD>		</MI>		<MI ca="23456" mt="343.234" sm="5636346345" xm="4534.234" ex="4">			<UD>				<D>key1=MI Data3</D>				<D>key2=&lt;xml&gt;&quot;data&quot;&lt;/xml&gt;</D>			</UD>		</MI>		<AC>			<NM>MAC/3453/CM/3345</NM>			<FN>MAC/192.168.100.100:8003/CM/com.cboe|@234523</FN>			<IN>QI</IN>		</AC>		<AC>			<NM>MAC/3453/CM/3345</NM>			<FN>MAC/192.168.100.100:8003/CM/com.cboe|@234523</FN>			<IN>QI</IN>		</AC>		<CI sn="W_MAIN" pt="7" ck="12345" />		<CI sn="W_MAIN" pt="11" pk="123456"/>	</CD>	<CD>		<NM>MAC/3453/CM/5446</NM>		<FN>MAC/192.168.100.100:8003/CM/com.cboe|@535345</FN>		<TI ce="3" sr="34" pe="4" sh="78" ptc="3" pth="34"/>		<AC>			<NM>MAC/3453/CM/3345</NM>			<FN>MAC/192.168.100.100:8003/CM/com.cboeÂ¦@234523</FN>			<IN>QI</IN>		</AC>		<CI sn="W_MAIN" pt="7" ck="12345"/>		<CI sn="W_MAIN" pt="7" pk="123456"/>	</CD>	<CD>		<NM>MAC/3453/CM/5446</NM>		<FN>MAC/192.168.100.100:8003/CM/com.cboe|@535345</FN>		<QI ne="23" nd="2" nf="2" no="5" ps="56" cs="12" st="0"/>		<MI ca="23456" mt="343.234" sm="5636346345" xm="4534.234" ex="2"/>	</CD></CDR>